{
  "rules_version": "0.1.0-draft",
  "scope": "fluoride_only_v1",
  "language": "id",
  "readme": "Tabel aturan rekomendasi pasta gigi v1 (fluoride saja). SEMUA nilai berstatus needs_review atau draft: belum ada drg yang mengesahkan. Jangan dipakai sebagai klaim klinis sebelum reviewed_by dan reviewed_at terisi. Tidak ada nama merek di berkas ini (merek hanya di products.json).",
  "valid_age_months": {
    "min": 0,
    "max": 216,
    "status": "needs_review",
    "rationale": "Rentang usia wajar untuk pengguna aplikasi (0-18 th). Di luar rentang = galat usia tidak valid.",
    "source": "Asumsi tim teknis (PRD tidak menentukan); tidak ada sumber klinis [PERLU VERIFIKASI oleh drg]",
    "reviewed_by": null,
    "reviewed_at": null
  },
  "regulatory_ceiling_ppm": {
    "value": 1500,
    "status": "needs_review",
    "rationale": "Plafon 0,15% (= 1500 ppm) dari Permenkes 445/1998; rekomendasi tidak pernah melewati plafon. Status berlaku belum terverifikasi.",
    "source": "Permenkes 445/1998: batas fluoride kosmetik/higiene mulut 0,15% (= 1500 ppm) via jurnal hukum (sumber sekunder); apakah masih berlaku di bawah Peraturan BPOM 23/2019 jo. 17/2022 [PERLU VERIFIKASI] (docs/research/03_ai_components.md §3.3)",
    "reviewed_by": null,
    "reviewed_at": null
  },
  "min_products": 2,
  "age_bands": [
    {
      "id": "pre_eruption",
      "label": "Belum ada gigi (0-5 bulan)",
      "age_months": {
        "min": 0,
        "max": 5,
        "status": "needs_review",
        "rationale": "Batas 6 bulan = perkiraan gigi pertama tumbuh; tidak ada di sumber riset [PERLU VERIFIKASI].",
        "source": "Asumsi tim teknis (PRD tidak menentukan); tidak ada sumber klinis [PERLU VERIFIKASI oleh drg]",
        "reviewed_by": null,
        "reviewed_at": null
      },
      "fluoride_ppm": {
        "candidates": [],
        "decision_pending": false,
        "selected_candidate_id": null,
        "status": "needs_review",
        "rationale": "Tidak ada kadar fluoride yang disarankan sebelum gigi tumbuh; ini asumsi dan harus disahkan drg (fluoride < 6 th menurut PDGI/IDAI masih terbuka).",
        "source": "Walsh dkk. 2019, Cochrane CD007868 (hanya abstrak; efek naik dengan konsentrasi, bermakna pada >= 1000 ppm) https://cochranelibrary.com/cdsr/doi/10.1002/14651858.CD007868.pub3/information; docs/research/03_ai_components.md §3.3; SNI 16-4767-1998 (pasta gigi anak: fluor bebas maks. 500-1000 ppm, tanpa sukrosa) via sumber sekunder, tampak usang (docs/research/03_ai_components.md §3.3) [PERLU VERIFIKASI teks resmi dan apakah masih berlaku]; Permenkes 445/1998: batas fluoride kosmetik/higiene mulut 0,15% (= 1500 ppm) via jurnal hukum (sumber sekunder); apakah masih berlaku di bawah Peraturan BPOM 23/2019 jo. 17/2022 [PERLU VERIFIKASI] (docs/research/03_ai_components.md §3.3)",
        "reviewed_by": null,
        "reviewed_at": null
      },
      "amount": {
        "code": "none_until_first_tooth",
        "message_id": "no_toothpaste_before_first_tooth",
        "status": "needs_review",
        "rationale": "Belum perlu pasta gigi sebelum gigi pertama tumbuh; gusi dibersihkan dengan kain lembap. Tidak ada di sumber riset [PERLU VERIFIKASI].",
        "source": "AAPD/AAP via ringkasan sekunder (docs/research/03_ai_components.md §3.3): < 3 th sebutir beras/smear, 3-6 th sebesar kacang polong [PERLU VERIFIKASI ke dokumen asli]",
        "reviewed_by": null,
        "reviewed_at": null
      },
      "supervision": {
        "required": true,
        "until_age_months": 84,
        "message_id": "supervise_until_7y",
        "status": "needs_review",
        "rationale": "Awasi sikat gigi sampai usia >= 7 tahun (84 bulan). Batas 84 bulan harus disahkan drg.",
        "source": "EAPD via ringkasan sekunder (docs/research/03_ai_components.md §3.3): < 1000 ppm 'dapat dipertimbangkan' tetapi bukti terbatas; awasi sikat gigi sampai >= 7 th [PERLU VERIFIKASI ke dokumen asli]",
        "reviewed_by": null,
        "reviewed_at": null
      },
      "note_ids": [
        "no_toothpaste_before_first_tooth"
      ],
      "generic_message_id": "no_toothpaste_before_first_tooth"
    },
    {
      "id": "toddler_6_35m",
      "label": "Gigi susu awal (6 bulan sampai kurang dari 3 tahun)",
      "age_months": {
        "min": 6,
        "max": 35,
        "status": "needs_review",
        "rationale": "Batas usia < 3 th mengikuti ringkasan AAPD/AAP; harus disahkan drg.",
        "source": "Asumsi tim teknis (PRD tidak menentukan); tidak ada sumber klinis [PERLU VERIFIKASI oleh drg]",
        "reviewed_by": null,
        "reviewed_at": null
      },
      "fluoride_ppm": {
        "candidates": [
          {
            "id": "guideline_ge1000",
            "label": "Anjuran pedoman: 1000-1450 ppm",
            "ppm_min": 1000,
            "ppm_max": 1450,
            "rationale": "Anjuran fluoride >= 1000 ppm (pilihan 1000-1450) untuk risiko karies pada semua usia; efek naik dengan konsentrasi.",
            "source": "Walsh dkk. 2019, Cochrane CD007868 (hanya abstrak; efek naik dengan konsentrasi, bermakna pada >= 1000 ppm) https://cochranelibrary.com/cdsr/doi/10.1002/14651858.CD007868.pub3/information; docs/research/03_ai_components.md §3.3; EAPD via ringkasan sekunder (docs/research/03_ai_components.md §3.3): < 1000 ppm 'dapat dipertimbangkan' tetapi bukti terbatas; awasi sikat gigi sampai >= 7 th [PERLU VERIFIKASI ke dokumen asli]"
          },
          {
            "id": "sni_legacy_500_1000",
            "label": "SNI lama untuk pasta gigi anak: 500-1000 ppm",
            "ppm_min": 500,
            "ppm_max": 1000,
            "rationale": "Standar lama membatasi fluor bebas 500-1000 ppm untuk pasta gigi anak; bertentangan dengan anjuran >= 1000 ppm, dan produk anak 500 ppm sangat umum di pasar.",
            "source": "SNI 16-4767-1998 (pasta gigi anak: fluor bebas maks. 500-1000 ppm, tanpa sukrosa) via sumber sekunder, tampak usang (docs/research/03_ai_components.md §3.3) [PERLU VERIFIKASI teks resmi dan apakah masih berlaku]"
          }
        ],
        "decision_pending": true,
        "selected_candidate_id": null,
        "status": "needs_review",
        "rationale": "Konflik belum diputuskan: SNI lama 500-1000 ppm vs anjuran >= 1000 ppm. Kedua kandidat ditampilkan; pilihan final oleh drg/PDGI/IDAI (isi selected_candidate_id lalu decision_pending=false).",
        "source": "Walsh dkk. 2019, Cochrane CD007868 (hanya abstrak; efek naik dengan konsentrasi, bermakna pada >= 1000 ppm) https://cochranelibrary.com/cdsr/doi/10.1002/14651858.CD007868.pub3/information; docs/research/03_ai_components.md §3.3; SNI 16-4767-1998 (pasta gigi anak: fluor bebas maks. 500-1000 ppm, tanpa sukrosa) via sumber sekunder, tampak usang (docs/research/03_ai_components.md §3.3) [PERLU VERIFIKASI teks resmi dan apakah masih berlaku]; Permenkes 445/1998: batas fluoride kosmetik/higiene mulut 0,15% (= 1500 ppm) via jurnal hukum (sumber sekunder); apakah masih berlaku di bawah Peraturan BPOM 23/2019 jo. 17/2022 [PERLU VERIFIKASI] (docs/research/03_ai_components.md §3.3)",
        "reviewed_by": null,
        "reviewed_at": null
      },
      "amount": {
        "code": "smear",
        "message_id": "amount_smear",
        "status": "needs_review",
        "rationale": "Usia < 3 th: olesan tipis / sebutir beras (AAPD/AAP, ringkasan sekunder).",
        "source": "AAPD/AAP via ringkasan sekunder (docs/research/03_ai_components.md §3.3): < 3 th sebutir beras/smear, 3-6 th sebesar kacang polong [PERLU VERIFIKASI ke dokumen asli]",
        "reviewed_by": null,
        "reviewed_at": null
      },
      "supervision": {
        "required": true,
        "until_age_months": 84,
        "message_id": "supervise_until_7y",
        "status": "needs_review",
        "rationale": "Awasi sikat gigi sampai usia >= 7 tahun (84 bulan). Batas 84 bulan harus disahkan drg.",
        "source": "EAPD via ringkasan sekunder (docs/research/03_ai_components.md §3.3): < 1000 ppm 'dapat dipertimbangkan' tetapi bukti terbatas; awasi sikat gigi sampai >= 7 th [PERLU VERIFIKASI ke dokumen asli]",
        "reviewed_by": null,
        "reviewed_at": null
      },
      "note_ids": [
        "look_for_ppm_on_pack",
        "spit_dont_swallow",
        "rinse_little"
      ],
      "generic_message_id": "generic_conservative"
    },
    {
      "id": "preschool_36_83m",
      "label": "Prasekolah (3 sampai 6 tahun)",
      "age_months": {
        "min": 36,
        "max": 83,
        "status": "needs_review",
        "rationale": "Batas 3-6 th mengikuti ringkasan AAPD/AAP; harus disahkan drg.",
        "source": "Asumsi tim teknis (PRD tidak menentukan); tidak ada sumber klinis [PERLU VERIFIKASI oleh drg]",
        "reviewed_by": null,
        "reviewed_at": null
      },
      "fluoride_ppm": {
        "candidates": [
          {
            "id": "guideline_ge1000",
            "label": "Anjuran pedoman: 1000-1450 ppm",
            "ppm_min": 1000,
            "ppm_max": 1450,
            "rationale": "Anjuran fluoride >= 1000 ppm (pilihan 1000-1450) untuk risiko karies pada semua usia; efek naik dengan konsentrasi.",
            "source": "Walsh dkk. 2019, Cochrane CD007868 (hanya abstrak; efek naik dengan konsentrasi, bermakna pada >= 1000 ppm) https://cochranelibrary.com/cdsr/doi/10.1002/14651858.CD007868.pub3/information; docs/research/03_ai_components.md §3.3; EAPD via ringkasan sekunder (docs/research/03_ai_components.md §3.3): < 1000 ppm 'dapat dipertimbangkan' tetapi bukti terbatas; awasi sikat gigi sampai >= 7 th [PERLU VERIFIKASI ke dokumen asli]"
          },
          {
            "id": "sni_legacy_500_1000",
            "label": "SNI lama untuk pasta gigi anak: 500-1000 ppm",
            "ppm_min": 500,
            "ppm_max": 1000,
            "rationale": "Standar lama membatasi fluor bebas 500-1000 ppm untuk pasta gigi anak; bertentangan dengan anjuran >= 1000 ppm, dan produk anak 500 ppm sangat umum di pasar.",